1;FR0010245803;Velcan Energy;10.5;Velcan développe des centrales à biomasse et des unités de production d'énergie hydroélectrique en Inde, au Brésil et en France. Velcan se recentre sur l'hydroélectrique en 2008.!
2;FR0010465534;Eo2;7,7;La société Eo2 est cotée sur le nouveau marché (FR0010465534 - MLEO). Elle fabrique du combustible pour chaudière à partir de déchets de bois.!
3;FR0011284991;Futuren;1,135;Conformément à l'accord conclu le 10 mai dernier avec le concert d'actionnaires majoritaires de Futuren, EDF Energies Nouvelles a mis la main sur la société. De quoi assurer une belle plus-value aux porteurs d'actions puisque la hausse représente près de 50% depuis le 1er janvier dernier.!
4;FR0011995588;Voltalia;10,8;En hausse de 33% depuis le début de l'année en bourse de Paris, Voltalia est spécialisée dans la production d'électricité à partir d'énergies renouvelables, dont l'exploitation de parcs éoliens, de centrales solaires et de centrales de biomasse et hydrauliques.!
5;FR0000039232;Aurea;8,18;En hausse de plus de 30% depuis le 1er janvier, Aurea est spécialisé dans les prestations de recyclage des huiles moteurs usagées (n° 1 européen), des déchets de PVC (n° 1 européen aussi), de l'aluminium, des plastiques complexes et du cuivre. En outre, le groupe développe des prestations de traitement des pneus usagés et de dépollution des eaux.!
6;FR0000060402;Albioma;20,8;Le producteur d'énergie indépendant est le leader mondial de la valorisation à haute efficacité énergétique de la biomasse en partenariat avec les agro-industriels. Depuis plus de 20 ans, le groupe exploite des centrales thermiques valorisant la bagasse, coproduit fibreux de la canne à sucre.!
7;FR0011289198;Global EcoPower;3,04;"GEP est un constructeur ""clés en main"" de centrales autonomes de production d'électricité mettant en oeuvre des énergies renouvelables : l'éolien et le photovoltaïque. GEP acquiert les droits, met en place les financements, construit et raccorde les centrales avant de les céder à des tiers-investisseurs, tout en poursuivant leur exploitation. Le titre s'adjuge 10% depuis le début de l'année.!"
8;FR0010245803;Velcan;10,05;En hausse de 10% depuis janvier, Velcan développe et exploite des concessions hydroélectriques au potentiel encore inexploité sur les marchés émergents. L'entreprise a pour ambition de devenir l'un des leaders du marché des concessions hydroélectriques de moins de 200 MW.!
9;FR0000054694;Naturex;90,4;Stable depuis le début de l'exercice boursier, Naturex est le leader mondial des ingrédients naturels de spécialité d'origine végétale. Le groupe, basé à Avignon, est organisé autour des trois marchés stratégiques Food & Beverage, Nutrition & Health et Personal Care, produit et commercialise des ingrédients naturels de spécialité d'origine végétale pour les industries agroalimentaire, nutraceutique, pharmaceutique et cosmétique.!/Users/Alice/Desktop/EnergyPortfolioManagement/BDD/PriceHistoryTable.csv!